{
  "$schema": "./schema.json",
  "id": "crisis-mars-v1",
  "name": "Crisis: Mars",
  "version": "1.0",
  "description": "A 12-18 player megagame about negotiation, war, trade routes, corporate interests, Martian independence, and asteroid-belt politics, set in the year 2241.",
  "default_player_count_min": 12,
  "default_player_count_max": 18,
  "setting": {
    "intro": "The year is 2241 and humanity has colonised the inner solar system with space stations and mining in the asteroid belt, and a colony and terraforming project on Mars.\nIn recent years a growing movement on Mars is pushing for independence from the United Nations of Earth and they have just gained a majority in the Martian senate\u2026\nYou will take the role of an actor on the edge of this brewing conflict. You will have limited opportunity to change its course but conflict gives you the chance to achieve your own goals.",
    "locations": "Earth has a population of 30 billion and is still the production and political centre of human life.\nLuna has been heavily developed for almost a hundred years and many corporations based there are given their own sovereign territory.\nMars has been slowly terraformed over the last 4 decades, with humanity currently having to live underground. Still, there are roughly 20 million colonists, half of which are involved in the terraforming effort.\nDeimos and Phobos are Mars's small moons that are used as supply stations for space ships.\nCeres, Vesta and Pallas are the three biggest stations in the asteroid belt, providing vital resources to both Earth and the Martian terraforming effort.",
    "factions_overview": "Canopy Corp: A Luna based corporation with the UN contract to terraform Mars.\nViva Mars: A radical martian freedom fighting group. They feel like they have been left behind by the martian senate.\nBelt Union: The workers of the asteroid belt, supplying goods to Earth and Mars.\nUNSS: The United Nations Security Service is a powerful and shadowy organisation that gathers and acts upon intelligence about threats to Earth.\nDeimos Rising Corp: A state owned Martian corporation that operates the station on the Martian moon of Deimos.\nFree Federation: A ragtag collection of pirates from the Belt."
  },
  "schedule": {
    "prologue_seconds": 1800,
    "epilogue_seconds": 600,
    "turns": [
      { "number": 1, "team_seconds": 300, "negotiation_seconds": 300, "action_seconds": 600 },
      { "number": 2, "team_seconds": 300, "negotiation_seconds": 300, "action_seconds": 600 },
      { "number": 3, "team_seconds": 300, "negotiation_seconds": 300, "action_seconds": 600 },
      { "number": 4, "team_seconds": 300, "negotiation_seconds": 300, "action_seconds": 600 }
    ]
  },
  "factions": [
    {
      "id": "canopy-corp",
      "name": "Canopy Corp",
      "short_name": "Canopy",
      "colour": "#1F6FEB",
      "icon_url": "Icons/CanopyLarge.png",
      "icon_small_url": "Icons/CanopySmall.png",
      "icon_colour_url": "Icons/CanopyColour.png",
      "public_brief": "Canopy P.L.C. was initially founded to develop and deploy habitats during the colonisation of Luna. Until it won the contract to terraform Mars it was a mid-sized mega-corporation, but over the last 40 years it has grown to one of the largest non-state entities in the solar system.\nThe Martian terraforming project is now vital to the future of Canopy Corp and the political unrest is an unwelcome disruption to normal operations.",
      "common_goals": [
        "The UN are the only faction who can credibly afford terraforming, so they need to keep control of Mars.",
        "Keep the terraforming project active, including the trade route from the Asteroid Belt to Mars.",
        "Luna in general, and Canopy Corp in particular, should remain prosperous.",
        "The Martian Senate should be controlled by corporations, or at least the Politicians."
      ],
      "sort_order": 1
    },
    {
      "id": "unss",
      "name": "UNSS",
      "short_name": "UNSS",
      "colour": "#0B3D91",
      "icon_url": "Icons/UNSSLarge.png",
      "icon_small_url": "Icons/UNSSSmall.png",
      "icon_colour_url": "Icons/UNSSColour.png",
      "public_brief": "The Unified Nations Security Service is a joint intelligence agency working for the Earth Gov to ensure stability on Earth, in the inner system and intercepting threats to the sovereignty of Earth.\nLittle is known about just how broad their mandate is, but there have been unofficial reports of paramilitary operations and infiltration of other parts of the UN.",
      "common_goals": [
        "Ensure Earth is never threatened or attacked.",
        "Win the war against Mars.",
        "Secure Earth's interests in the Asteroid Belt.",
        "Ensure the loyalty of the corporations and traders to Earth."
      ],
      "sort_order": 2
    },
    {
      "id": "viva-mars",
      "name": "Viva Mars",
      "short_name": "Viva Mars",
      "colour": "#D6371E",
      "icon_url": "Icons/VivaMarsLarge.png",
      "icon_small_url": "Icons/VivaMarsSmall.png",
      "icon_colour_url": "Icons/VivaColour.png",
      "public_brief": "Viva Mars was there at the start of the independence movement, before it became mainstream and the politicians became involved. It started with a socialist dream, equality for all Martians as well as freedom from Earth, but the Senate wants to keep their power.\nAs much as your main aim has never been closer to being realised, the new wave of opportunistic politicians and military folk seem hell bent on turning Mars into a copy of Earth, and bending the knee to the same old corporations.",
      "common_goals": [
        "The Martian war for independence should be a success.",
        "The Martian Senate should be returned to the people.",
        "Recruit as many allies as possible.",
        "The future of Mars relies on the terraforming project continuing."
      ],
      "sort_order": 3
    },
    {
      "id": "deimos-rising",
      "name": "Deimos Rising Corp",
      "short_name": "Deimos Rising",
      "colour": "#9A4AE0",
      "icon_url": "Icons/DeimosLarge.png",
      "icon_small_url": "Icons/DeimosSmall.png",
      "icon_colour_url": "Icons/DeimosColour.png",
      "public_brief": "Deimos was the first Martian Senate backed corporation, ratified by Earth Gov, given corporate sovereignty over the moon of Deimos and a charter to facilitate trade to and from Mars.\nThe senate has stated that, if independence is won then Deimos Rising will be taken public, which could result in a healthy payday if their shares are high.",
      "common_goals": [
        "Outperform the Belt Union for trading.",
        "Keep Mars stable, with the Senate controlled by the Corps or Politicians.",
        "Muscle in on the Terraforming project.",
        "Keep your valuation high."
      ],
      "sort_order": 4
    },
    {
      "id": "belt-union",
      "name": "Belt Union",
      "short_name": "Belt Union",
      "colour": "#E0A526",
      "icon_url": "Icons/BeltUnionLarge.png",
      "icon_small_url": "Icons/BeltUnionSmall.png",
      "icon_colour_url": "Icons/BeltUnionColour.png",
      "public_brief": "Once mining in the asteroid belt had been proved viable a new gold rush for rare ores and materials from the belt began. The early pioneers had to lease spacecraft from the corporations that could afford to build them.\nOver time this settled down into a status quo where large mining companies would hire freelancer mining crews to perform the dangerous work.\nThe Belt Union was formed from these workers in order to counterbalance the power of the corps that employ them and operate several space stations in the asteroid belt.",
      "common_goals": [
        "Ceres, Vesta and Pallas should be as prosperous as possible.",
        "Both Mars and Earth should remain in political turmoil, so you can claim more independence for the Asteroid Belt.",
        "Keep trade flowing between the Belt and the inner planets.",
        "Gain control of shipping in the Asteroid Belt."
      ],
      "sort_order": 5
    },
    {
      "id": "free-federation",
      "name": "Free Federation",
      "short_name": "Free Fed",
      "colour": "#2E2E2E",
      "icon_url": "Icons/FreeFedLarge.png",
      "icon_small_url": "Icons/FreeFedSmall.png",
      "icon_colour_url": "Icons/FreeFedColour.png",
      "public_brief": "Space piracy is in its infancy, as only recently has access to small space vessels become easier and trade more common. The Corsairs are a loose federation of those who are looking for wealth or freedom in space. Their founder, Dread Lizzy, was recently killed in a UN raid and now the Federation finds itself leaderless.",
      "common_goals": [
        "Resolve the leadership question.",
        "Gain power and wealth for the Federation.",
        "Be seen as a faction to be feared and respected.",
        "Gain control of shipping in the Asteroid Belt."
      ],
      "sort_order": 6
    }
  ],
  "roles": [
    {
      "code": "C1",
      "name": "C.E.O.",
      "faction_id": "canopy-corp",
      "public_description": "Chief Executive Officer of Canopy Corp.",
      "private_brief": "You are a career corporate actor, chosen from the privileged upper class of Luna.\nAll that matters in this life is achieving the personal wealth and power required to protect yourself and your loved ones.",
      "personal_goal": "You are due a massive bonus at the end of turn 4, so all that matters is Canopy Corp's share price at that moment.",
      "initiative_by_turn": [14, 5, 1, 14],
      "availability": [
        { "player_count": 12, "is_recommended": true },
        { "player_count": 18, "is_recommended": true }
      ],
      "sort_order": 1
    },
    {
      "code": "C2",
      "name": "C.T.O.",
      "faction_id": "canopy-corp",
      "public_description": "Chief Technology Officer of Canopy Corp.",